[
  {
    "experience_id": "exp.bridge.j",
    "version": 1,
    "stage": "junior",
    "age_range": [3, 5],
    "difficulty": 1,
    "learning_objectives": ["concept.force"],
    "mission": {
      "title_key": "exp.bridge.j.title",
      "objective_key": "exp.bridge.j.objective"
    },
    "seed": 42,
    "variables": { "gravity": 9.8 },
    "constraints": {
      "max_pieces": 5,
      "budget": 50,
      "gap_width": 3,
      "piece_types": ["plank", "pillar"],
      "vehicles": ["car", "truck"]
    },
    "ui": {
      "read_aloud": true,
      "no_text_required": true,
      "large_targets": true,
      "force_view": false,
      "test_log": false
    },
    "assessment": { "success_conditions": ["vehicle_crosses", "bridge_holds_3s"] },
    "telemetry": ["piece_placed", "run_finished"]
  },
  {
    "experience_id": "exp.bridge.e",
    "version": 1,
    "stage": "explorer",
    "age_range": [6, 8],
    "difficulty": 2,
    "learning_objectives": ["concept.load"],
    "mission": {
      "title_key": "exp.bridge.e.title",
      "objective_key": "exp.bridge.e.objective"
    },
    "seed": 42,
    "variables": { "gravity": 9.8 },
    "constraints": {
      "max_pieces": 10,
      "budget": 100,
      "gap_width": 3,
      "piece_types": ["plank", "pillar", "beam", "brace"],
      "vehicles": ["car", "truck"]
    },
    "ui": {
      "read_aloud": true,
      "no_text_required": false,
      "large_targets": false,
      "force_view": true,
      "test_log": false
    },
    "assessment": {
      "success_conditions": ["vehicle_crosses", "bridge_holds_5s"]
    },
    "telemetry": ["piece_placed", "run_finished", "force_view_toggled"]
  },
  {
    "experience_id": "exp.bridge.m",
    "version": 1,
    "stage": "maker",
    "age_range": [8, 10],
    "difficulty": 3,
    "learning_objectives": ["concept.structure", "concept.load"],
    "mission": {
      "title_key": "exp.bridge.m.title",
      "objective_key": "exp.bridge.m.objective"
    },
    "seed": 42,
    "variables": { "gravity": 9.8 },
    "constraints": {
      "max_pieces": 15,
      "budget": 120,
      "gap_width": 3,
      "piece_types": ["plank", "pillar", "beam", "brace"],
      "vehicles": ["car", "truck", "train"]
    },
    "ui": {
      "read_aloud": true,
      "no_text_required": false,
      "large_targets": false,
      "force_view": true,
      "test_log": true
    },
    "assessment": {
      "success_conditions": ["vehicle_crosses", "bridge_holds_5s", "cost<=budget"]
    },
    "telemetry": [
      "piece_placed",
      "run_finished",
      "force_view_toggled",
      "design_changed_after_run"
    ]
  }
]
